id,year,report,sector,industry,company,sentence,label,rel_C,conf_C,keywords_C,rationale_C,raw_C
2243,2020,3M_2020_ESG,Manufacturing,Capital Goods,3M,"Through an online survey, 3M suppliers can provide complete supply chain information all the way to the forest sources, or they can easily forward parts of the online survey to their suppliers paper or pulp mills, for example for completion.",,Yes,0.95,supply chain information|forest sources|paper or pulp mills,"The sentence describes a system for tracking supply chain information back to forest sources, which is directly relevant to environmental aspects of responsible sourcing and deforestation prevention, particularly in the context of paper and pulp products.","{""relevance"": ""Yes"", ""confidence"": 0.95, ""keywords"": [""supply chain information"", ""forest sources"", ""paper or pulp mills""], ""rationale"": ""The sentence describes a system for tracking supply chain information back to forest sources, which is directly relevant to environmental aspects of responsible sourcing and deforestation prevention, particularly in the context of paper and pulp products.""}"
19294,2020,Novartis_2020_ESG,Manufacturing,Pharmaceutical,Novartis,Novartis invested in two pilot projects to support these efforts in 2020.,,No,0.95,,"The sentence mentions investment in 'two pilot projects' and 'these efforts' but lacks specific context about what 'these efforts' refer to, making it impossible to determine any ESG relevance. Without further information, it's a generic statement about corporate activity.","{""relevance"": ""No"", ""confidence"": 0.95, ""keywords"": [], ""rationale"": ""The sentence mentions investment in 'two pilot projects' and 'these efforts' but lacks specific context about what 'these efforts' refer to, making it impossible to determine any ESG relevance. Without further information, it's a generic statement about corporate activity.""}"
1395,2020,3M_2020_ESG,Manufacturing,Capital Goods,3M,"In 2019, we launched 10 data science and eight digitization functional learning paths, leading to over 3,800 completions.",,Yes,0.85,functional learning paths|data science|digitization,"The sentence describes investments in employee training and development, specifically in data science and digitization, which falls under the Social (S) aspect of ESG by enhancing human capital and workforce skills.","{""relevance"": ""Yes"", ""confidence"": 0.85, ""keywords"": [""functional learning paths"", ""data science"", ""digitization""], ""rationale"": ""The sentence describes investments in employee training and development, specifically in data science and digitization, which falls under the Social (S) aspect of ESG by enhancing human capital and workforce skills.""}"
5226,2021,3M_2021_ESG,Manufacturing,Capital Goods,3M,"Health, wealth, wellness, and resilience create a framework for a collection of programs, resources, and services designed to help employees and their families achieve their well-being goals.",,Yes,0.95,Health|wealth|wellness|resilience|employees|well-being goals,"The sentence directly addresses employee well-being, including health, wealth, wellness, and resilience, which are core components of the Social (S) aspect of ESG, specifically under human capital management and employee welfare.","{""relevance"": ""Yes"", ""confidence"": 0.95, ""keywords"": [""Health"", ""wealth"", ""wellness"", ""resilience"", ""employees"", ""well-being goals""], ""rationale"": ""The sentence directly addresses employee well-being, including health, wealth, wellness, and resilience, which are core components of the Social (S) aspect of ESG, specifically under human capital management and employee welfare.""}"
9154,2022,AcBel Polytech_2022_ESG,Manufacturing,Capital Goods,AcBel Polytech,"By collaborating with supply chain partners, they can achieve low-carbon value creation and ultimately realize the benefits of overall value chain innovation and upgrading.",,Yes,0.95,supply chain partners|low-carbon value creation|value chain innovation,"The sentence explicitly mentions 'low-carbon value creation' and collaboration with 'supply chain partners' for innovation, which directly relates to environmental aspects of ESG and sustainable supply chain management.","{""relevance"": ""Yes"", ""confidence"": 0.95, ""keywords"": [""supply chain partners"", ""low-carbon value creation"", ""value chain innovation""], ""rationale"": ""The sentence explicitly mentions 'low-carbon value creation' and collaboration with 'supply chain partners' for innovation, which directly relates to environmental aspects of ESG and sustainable supply chain management.""}"
11240,2022,AcBel Polytech_2022_ESG,Manufacturing,Capital Goods,AcBel Polytech,"Remuneration packages at AcBel are designed based on the responsibilities and requirements of different positions, and it does not discriminate based on gender.",,Yes,0.95,Remuneration packages|discriminate|gender,"The sentence directly addresses non-discrimination based on gender in remuneration, which is a key aspect of social equity and fair labor practices under the Social (S) dimension of ESG.","{""relevance"": ""Yes"", ""confidence"": 0.95, ""keywords"": [""Remuneration packages"", ""discriminate"", ""gender""], ""rationale"": ""The sentence directly addresses non-discrimination based on gender in remuneration, which is a key aspect of social equity and fair labor practices under the Social (S) dimension of ESG.""}"
1393,2020,3M_2020_ESG,Manufacturing,Capital Goods,3M,"Develop U provides access to tens of thousands of unique, just-in-time learning resources in over 15 languages, allowing 3M s global workforce to engage in employee development.",,Yes,0.95,employee development|learning resources|global workforce,"The sentence directly addresses employee development and access to learning resources for a global workforce, which are key aspects of social sustainability (S) within ESG, focusing on human capital development and employee well-being.","{""relevance"": ""Yes"", ""confidence"": 0.95, ""keywords"": [""employee development"", ""learning resources"", ""global workforce""], ""rationale"": ""The sentence directly addresses employee development and access to learning resources for a global workforce, which are key aspects of social sustainability (S) within ESG, focusing on human capital development and employee well-being.""}"
17055,2023,Ford_2023_ESG,Manufacturing,Automobiles and Components,Ford,Function Areas Sustainability and Vehicle Environmental Matters Coordinates our Company-wide sustainability strategy and activities Leads our sustainability reporting and stakeholder engagement Collaborates with other functional areas and skill teams to integrate sustainability throughout the Company.,,Yes,0.95,Sustainability strategy|sustainability reporting|stakeholder engagement|integrate sustainability,"The sentence explicitly details a function area dedicated to coordinating and leading the company's sustainability strategy, reporting, and stakeholder engagement, which are core aspects of ESG management.","{""relevance"": ""Yes"", ""confidence"": 0.95, ""keywords"": [""Sustainability strategy"", ""sustainability reporting"", ""stakeholder engagement"", ""integrate sustainability""], ""rationale"": ""The sentence explicitly details a function area dedicated to coordinating and leading the company's sustainability strategy, reporting, and stakeholder engagement, which are core aspects of ESG management.""}"
4691,2021,3M_2021_ESG,Manufacturing,Capital Goods,3M,"We successfully evolved our in-person training to a virtual environment, reaching approximately 25K employees.",,Yes,0.85,training|employees|virtual environment,"The sentence discusses employee training, which is a key aspect of human capital development under the Social (S) pillar of ESG. The shift to a virtual environment also highlights adaptability in employee development programs.","{""relevance"": ""Yes"", ""confidence"": 0.85, ""keywords"": [""training"", ""employees"", ""virtual environment""], ""rationale"": ""The sentence discusses employee training, which is a key aspect of human capital development under the Social (S) pillar of ESG. The shift to a virtual environment also highlights adaptability in employee development programs.""}"
20544,2022,TSMC_2022_TCFD,Manufacturing,UNKNOWN,TSMC,"Risk mitigations are supervised by the Risk Management Steering Committee, which reports progress to the Board.",,Yes,0.9,Risk Management Steering Committee|reports progress to the Board|Risk mitigations,"The sentence describes a governance structure (Risk Management Steering Committee reporting to the Board) responsible for supervising risk mitigations, which is a key aspect of effective corporate governance and oversight of ESG risks.","{""relevance"": ""Yes"", ""confidence"": 0.9, ""keywords"": [""Risk Management Steering Committee"", ""reports progress to the Board"", ""Risk mitigations""], ""rationale"": ""The sentence describes a governance structure (Risk Management Steering Committee reporting to the Board) responsible for supervising risk mitigations, which is a key aspect of effective corporate governance and oversight of ESG risks.""}"
15920,2022,Croda International_2022_ESG,Manufacturing,Chemicals,Croda International,The level of environmental provision is based on management s best estimate of the most likely outcome for each individual exposure.,,Yes,0.95,environmental provision|environmental exposure,"The sentence explicitly mentions 'environmental provision' and 'environmental exposure,' indicating a financial commitment related to environmental liabilities, which is a core E (Environmental) topic.","{""relevance"": ""Yes"", ""confidence"": 0.95, ""keywords"": [""environmental provision"", ""environmental exposure""], ""rationale"": ""The sentence explicitly mentions 'environmental provision' and 'environmental exposure,' indicating a financial commitment related to environmental liabilities, which is a core E (Environmental) topic.""}"
1987,2020,3M_2020_ESG,Manufacturing,Capital Goods,3M,"3M s Annual Report on Form 10-K, Item 1A outlines risk factors applicable to the company.",,No,0.95,Annual Report on Form 10-K|Item 1A|risk factors,"The sentence refers to a standard financial disclosure document (Form 10-K) and a section on general risk factors. It does not specifically mention any environmental, social, or governance risks or initiatives.","{""relevance"": ""No"", ""confidence"": 0.95, ""keywords"": [""Annual Report on Form 10-K"", ""Item 1A"", ""risk factors""], ""rationale"": ""The sentence refers to a standard financial disclosure document (Form 10-K) and a section on general risk factors. It does not specifically mention any environmental, social, or governance risks or initiatives.""}"
7427,2021,AcBel Polytech_2021_ESG,Manufacturing,Capital Goods,AcBel Polytech,Raising Awareness of Information Security of the Personnel Annual Requisition of All Personnel to Sign an Information Security Declaration Annual Performance of Information Security Simulation Exercises and Strengthening Information Security Awareness Monthly Informational E-newsletter Providing Information Security Information Advising and Supervising the Employees to Follow the Company's Information Security Policy Regular Arrangement of Online Information Safety Training for New Employees Aperiodic Physical Education Training on Information Security-related Topics.,,Yes,0.95,Information Security|personnel|training|awareness|policy,"The sentence details multiple initiatives related to information security, including training, awareness programs, and policy adherence for personnel. Information security is a key aspect of social (S) and governance (G) factors within ESG, as it relates to data privacy, ethical conduct, and risk management.","{""relevance"": ""Yes"", ""confidence"": 0.95, ""keywords"": [""Information Security"", ""personnel"", ""training"", ""awareness"", ""policy""], ""rationale"": ""The sentence details multiple initiatives related to information security, including training, awareness programs, and policy adherence for personnel. Information security is a key aspect of social (S) and governance (G) factors within ESG, as it relates to data privacy, ethical conduct, and risk management.""}"
14181,2022,Croda International_2022_ESG,Manufacturing,Chemicals,Croda International,Increasing the maximum annual bonus headroom to 200% of base salary to provide some additional flexibility but only in exceptional circumstances of recruitment.,,No,0.95,annual bonus|base salary|recruitment,"The sentence discusses executive compensation (annual bonus headroom) and recruitment flexibility, which are standard business and human resources topics. While executive compensation can sometimes touch upon governance (G) if it relates to fairness or stakeholder alignment, this specific statement is about a technical adjustment to bonus limits for recruitment purposes, not a broader governance principle or ESG-related compensation metric.","{""relevance"": ""No"", ""confidence"": 0.95, ""keywords"": [""annual bonus"", ""base salary"", ""recruitment""], ""rationale"": ""The sentence discusses executive compensation (annual bonus headroom) and recruitment flexibility, which are standard business and human resources topics. While executive compensation can sometimes touch upon governance (G) if it relates to fairness or stakeholder alignment, this specific statement is about a technical adjustment to bonus limits for recruitment purposes, not a broader governance principle or ESG-related compensation metric.""}"
4477,2021,3M_2021_ESG,Manufacturing,Capital Goods,3M,Develops and monitors adherence with strong sustainability-related policies and procedures.,,Yes,0.95,sustainability-related policies|procedures,"The sentence explicitly mentions 'sustainability-related policies and procedures,' indicating a direct focus on the company's approach to environmental, social, and governance issues. Monitoring adherence further strengthens its relevance to ESG management.","{""relevance"": ""Yes"", ""confidence"": 0.95, ""keywords"": [""sustainability-related policies"", ""procedures""], ""rationale"": ""The sentence explicitly mentions 'sustainability-related policies and procedures,' indicating a direct focus on the company's approach to environmental, social, and governance issues. Monitoring adherence further strengthens its relevance to ESG management.""}"
1424,2020,3M_2020_ESG,Manufacturing,Capital Goods,3M,"All our people globally, at every level of the 3M organization, are provided with opportunities to develop themselves as leaders.",,No,0.85,,"The sentence discusses leadership development opportunities for employees, which is a general human resources practice. While employee development can indirectly contribute to social capital, this statement is too generic to be considered a material ESG disclosure without further context linking it to specific social outcomes or diversity/inclusion initiatives.","{""relevance"": ""No"", ""confidence"": 0.85, ""keywords"": [], ""rationale"": ""The sentence discusses leadership development opportunities for employees, which is a general human resources practice. While employee development can indirectly contribute to social capital, this statement is too generic to be considered a material ESG disclosure without further context linking it to specific social outcomes or diversity/inclusion initiatives.""}"
8193,2021,AcBel Polytech_2021_ESG,Manufacturing,Capital Goods,AcBel Polytech,Risk Management Human Rights Protection Low-carbon and Environmental Protection Health Safety.,,Yes,0.95,Human Rights Protection|Low-carbon|Environmental Protection|Health Safety,"The sentence explicitly lists several key ESG topics, including human rights, environmental protection (low-carbon), and health and safety, indicating a direct relevance to social and environmental aspects of ESG.","{""relevance"": ""Yes"", ""confidence"": 0.95, ""keywords"": [""Human Rights Protection"", ""Low-carbon"", ""Environmental Protection"", ""Health Safety""], ""rationale"": ""The sentence explicitly lists several key ESG topics, including human rights, environmental protection (low-carbon), and health and safety, indicating a direct relevance to social and environmental aspects of ESG.""}"
2168,2020,3M_2020_ESG,Manufacturing,Capital Goods,3M,"This includes our use of certain minerals with the potential to be sourced from conflict-affected and high-risk areas, our use of timberbased products and other plant materials pulp and paper , and all new suppliers in higher-risk countries, in areas such as Asia Pacific, Latin America, or parts of the Europe, Middle East, and Africa regions.",,Yes,0.95,conflict-affected and high-risk areas|timberbased products|plant materials|new suppliers|higher-risk countries,"The sentence explicitly mentions the use of minerals from conflict-affected areas and timber-based products, which are direct social and environmental supply chain issues. It also refers to new suppliers in higher-risk countries, indicating a focus on responsible sourcing and supply chain due diligence, which are key ESG considerations.","{""relevance"": ""Yes"", ""confidence"": 0.95, ""keywords"": [""conflict-affected and high-risk areas"", ""timberbased products"", ""plant materials"", ""new suppliers"", ""higher-risk countries""], ""rationale"": ""The sentence explicitly mentions the use of minerals from conflict-affected areas and timber-based products, which are direct social and environmental supply chain issues. It also refers to new suppliers in higher-risk countries, indicating a focus on responsible sourcing and supply chain due diligence, which are key ESG considerations.""}"
13023,2022,Croda International_2022_ESG,Manufacturing,Chemicals,Croda International,Develop dashboards to next level of detail to make metrics and targets more transparent at regional and sector levels in addition to Board and Executive level reports.,,Yes,0.85,dashboards|metrics|targets|transparent,"The sentence discusses developing dashboards to make metrics and targets more transparent, which is crucial for effective ESG reporting and accountability, even if the specific ESG metrics are not explicitly mentioned. Transparency in reporting is a key governance aspect.","{""relevance"": ""Yes"", ""confidence"": 0.85, ""keywords"": [""dashboards"", ""metrics"", ""targets"", ""transparent""], ""rationale"": ""The sentence discusses developing dashboards to make metrics and targets more transparent, which is crucial for effective ESG reporting and accountability, even if the specific ESG metrics are not explicitly mentioned. Transparency in reporting is a key governance aspect.""}"
12489,2022,Croda International_2022_ESG,Manufacturing,Chemicals,Croda International,"This is creating significant growth opportunities, with commercial sales in multiple field crops and vegetables already secured.",,No,0.95,growth opportunities|commercial sales|field crops|vegetables,"The sentence discusses commercial sales and growth opportunities in agriculture, which is a business operational detail rather than a specific ESG topic. It does not mention sustainable practices, social impact, or governance structures.","{""relevance"": ""No"", ""confidence"": 0.95, ""keywords"": [""growth opportunities"", ""commercial sales"", ""field crops"", ""vegetables""], ""rationale"": ""The sentence discusses commercial sales and growth opportunities in agriculture, which is a business operational detail rather than a specific ESG topic. It does not mention sustainable practices, social impact, or governance structures.""}"
